{
 "uuid": "c77a0d86-7b58-4bd5-a2eb-bf2be44914a9",
 "name": "",
 "summary": "<placeholder text, 0 chars>",
 "created_at": "2025-01-07T00:46:20.487588Z",
 "updated_at": "2025-01-07T21:15:49.956114Z",
 "account": {
  "uuid": "e1f27e58-33e5-4a5d-836b-40a2b78055aa"
 },
 "chat_messages": [
  {
   "uuid": "9eeb8eb1-48f2-496e-b4c1-a8fea4b08ec4",
   "text": "<placeholder text, 0 chars>",
   "content": [],
   "sender": "human",
   "created_at": "2025-01-07T00:46:21.444705Z",
   "updated_at": "2025-01-07T21:15:49.956114Z",
   "attachments": [],
   "files": [],
   "parent_message_uuid": "00000000-0000-4000-8000-000000000000"
  },
  {
   "uuid": "b54a96f8-1723-4b12-a248-ae0399cf62e2",
   "text": "<placeholder text, 0 chars>",
   "content": [],
   "sender": "assistant",
   "created_at": "2025-01-07T00:46:41.793054Z",
   "updated_at": "2025-01-07T21:15:49.956114Z",
   "attachments": [],
   "files": [],
   "parent_message_uuid": "9eeb8eb1-48f2-496e-b4c1-a8fea4b08ec4"
  },
  {
   "uuid": "8c86a9f0-4591-4cfa-87c5-3c4572687746",
   "text": "<placeholder text, 0 chars>",
   "content": [],
   "sender": "human",
   "created_at": "2025-01-07T00:48:32.920323Z",
   "updated_at": "2025-01-07T21:15:49.956114Z",
   "attachments": [],
   "files": [],
   "parent_message_uuid": "b54a96f8-1723-4b12-a248-ae0399cf62e2"
  },
  {
   "uuid": "6bd2676b-fcce-474e-929c-0a86c4420dde",
   "text": "<placeholder text, 0 chars>",
   "content": [],
   "sender": "assistant",
   "created_at": "2025-01-07T00:48:45.891544Z",
   "updated_at": "2025-01-07T21:15:49.956114Z",
   "attachments": [],
   "files": [],
   "parent_message_uuid": "8c86a9f0-4591-4cfa-87c5-3c4572687746"
  }
 ]
}
